{
  "schema_version":"1.0.0",
  "policy_id":"mojoattention-ci-tier-applicability",
  "suite_manifest_schema":"schemas/product-validation-suite.schema.json",
  "missing_suite_outcome":"contract-invalid",
  "tiers":[
    {"tier_id":"fast","prerequisites":[],"path_prefixes":[],"event_classes":["pull-request","push-branch","push-main"],"required_artifacts":["contracts/validation-suites/fast.json","src/mojoattention/validation/fast.py"],"command":["scripts/quality.sh","--ci"]},
    {"tier_id":"correctness","prerequisites":[],"path_prefixes":["contracts/kernel","contracts/validation-suites/correctness.json","fixtures/golden","src/mojoattention/domain","src/mojoattention/backends","src/mojoattention/validation/correctness.py","tests/conformance","tests/correctness"],"event_classes":["pull-request","push-branch","push-main","schedule","workflow-dispatch","release"],"required_artifacts":["contracts/validation-suites/correctness.json","src/mojoattention/validation/correctness.py"],"command":["scripts/run.sh","mojoattention","validate","--suite","correctness"]},
    {"tier_id":"model","prerequisites":["correctness"],"path_prefixes":["contracts/validation-suites/model.json","src/mojoattention/model","src/mojoattention/validation/model.py","tests/model","fixtures/model"],"event_classes":["pull-request","push-branch","push-main","schedule","workflow-dispatch","release"],"required_artifacts":["contracts/validation-suites/model.json","src/mojoattention/validation/model.py"],"command":["scripts/run.sh","mojoattention","validate","--suite","model"]},
    {"tier_id":"training-smoke","prerequisites":["model"],"path_prefixes":["contracts/validation-suites/training-smoke.json","src/mojoattention/model/data","src/mojoattention/model/training","src/mojoattention/validation/training_smoke.py","tests/model/training","fixtures/data"],"event_classes":["pull-request","push-branch","push-main","schedule","workflow-dispatch","release"],"required_artifacts":["contracts/validation-suites/training-smoke.json","src/mojoattention/validation/training_smoke.py"],"command":["scripts/run.sh","mojoattention","validate","--suite","training-smoke"]},
    {"tier_id":"benchmark-smoke","prerequisites":["correctness"],"path_prefixes":["contracts/validation-suites/benchmark-smoke.json","src/mojoattention/benchmark","src/mojoattention/validation/benchmark_smoke.py","tests/benchmark","contracts/benchmark"],"event_classes":["pull-request","push-main","schedule","workflow-dispatch","release"],"required_artifacts":["contracts/validation-suites/benchmark-smoke.json","src/mojoattention/validation/benchmark_smoke.py"],"command":["scripts/run.sh","mojoattention","validate","--suite","benchmark-smoke"]},
    {"tier_id":"nightly","prerequisites":["correctness","model","training-smoke"],"path_prefixes":[],"event_classes":["schedule","workflow-dispatch"],"required_artifacts":["contracts/validation-suites/nightly.json","src/mojoattention/validation/nightly.py"],"command":["scripts/run.sh","mojoattention","validate","--suite","nightly"]},
    {"tier_id":"stable-benchmark","prerequisites":["correctness","benchmark-smoke"],"path_prefixes":[],"event_classes":["workflow-dispatch"],"required_artifacts":["contracts/validation-suites/stable-benchmark.json","src/mojoattention/validation/stable_benchmark.py"],"command":["scripts/run.sh","mojoattention","validate","--suite","stable-benchmark"]},
    {"tier_id":"release","prerequisites":["correctness","model","training-smoke","benchmark-smoke"],"path_prefixes":[],"event_classes":["release"],"required_artifacts":["contracts/validation-suites/release.json","src/mojoattention/validation/release.py"],"command":["scripts/run.sh","mojoattention","validate","--suite","release"]}
  ]
}
